,Content,Location,Username,Retweet-Count,Favorites,Created at
0,"Rankin not ready to commit $25M for affordable housing as recommended by commission | CBC News https://t.co/4fqcv7qmhZ 

Because the 100million they spent on an empty conference building for their foreign friends ....",Canada,justin_ep,0,0,2021-06-18 06:02:18
1,"From HFX Examiner: “If I ever do put together that PowerPoint presentation, one of the slides will be devoted to #AlbertBarbusci, the supposed ‘port developer’ for the Port of Sydney.” #NovaPort #corruption #cbrm #nspoli
https://t.co/5ThCqwYMMA https://t.co/zoIIGphQv4",Canada,CometsMum,0,0,2021-06-18 05:19:05
2,"#TheIrvings in charge in NB?&gt;#NovaScotia caught off guard by #NewBrunswick border reopening
https://t.co/gGHrobkXyJ https://t.co/XKaA3cF6pS",Canada,CometsMum,0,0,2021-06-18 04:33:37
3,A month ago @IainTRankin was ready to hold a world hockey tournament in NS and hasn't been able to give coherent direction since being appointed. Perhaps the unelected premier of NS should get his own ship in order before making comments #nbpoli #nspoli  https://t.co/jOUEv9P8Z4,,Bill_Henwood,0,0,2021-06-18 04:15:56
4,ICYMI: Branches Pocket Community residential housing under construction in West Pubnico | Saltwire https://t.co/e9sCFLYxZN,"Halifax, Nova Scotia, Canada",chronicleherald,0,1,2021-06-18 04:04:30
5,"Top story: Federal government backs rental housing project in Halifax | CBC News https://t.co/oatlSmH2K8, see more https://t.co/gjff6Qakyn",,SpuriousH,0,0,2021-06-18 03:07:45
6,"Nova Scotia is expecting 400,000 doses of the Moderna COVID-19 vaccine in the next few weeks. https://t.co/HdK75gyKzY",Canada,CBCNews,5,24,2021-06-18 03:00:01
7,"#ThrowbackThursday (from approx. 3 years ago): Nova Scotia Bans Declawing, Ear Cropping, De-Barking, and Tail Docking! https://t.co/r2VaR1Gw9X #Animals #AnimalProtection","Hudson County, NJ, USA",AmCuriousNJ,1,1,2021-06-18 02:31:55
8,"Algae toxins can cause rash, discomfort but unlikely to end in death, doctor says | Saltwire https://t.co/gDdR0mRqhF","Halifax, Nova Scotia, Canada",chronicleherald,0,0,2021-06-18 02:30:57
9,"Blue-green algae blight nothing new for N.S., says Mattatall Lake resident | Saltwire https://t.co/v93cFARRsn","Halifax, Nova Scotia, Canada",chronicleherald,2,0,2021-06-18 02:16:10
10,Retired Pictou teacher pens The Makers’ Canvas | Saltwire https://t.co/ZeKMKkd5rV,"New Glasgow, Nova Scotia",ngnews,0,0,2021-06-18 02:10:54
11,Fishermen's association seeks to intervene in First Nations' court cases | Saltwire https://t.co/3km3VZf1rr,"Halifax, Nova Scotia, Canada",chronicleherald,0,0,2021-06-18 02:00:30
12,"Sad but true. 
https://t.co/8WYNsiRLDw","Nova Scotia, Canada",pjdostal,0,0,2021-06-18 01:45:59
13,"@DalMgmtDean @DalManagement 'Otis and Clementine' is our family's favourite place. Books, coffee, and...kittens. What can be better than this? :)
https://t.co/6EJIDmReTP","Nova Scotia, Canada",OksanaShkurska,0,1,2021-06-18 01:43:32
14,"“While enroute back to Digby, sheriff services received a phone call from (Central Nova Scotia Correctional Facility) staff advising them that Robicheau had informed (them) that there had been a firearm in the back of his prisoner transportation compart... https://t.co/QAnryf7Xzz https://t.co/Wijcnu77N3","Halifax, Nova Scotia, Canada",chronicleherald,0,1,2021-06-18 01:14:21
15,"“While enroute back to Digby, sheriff services received a phone call from (Central Nova Scotia Correctional Facility) staff advising them that Robicheau had informed (them) that there had been a firearm in the back of his prisoner transportation compart... https://t.co/UTBXkkJJ9h https://t.co/8S5oogQHqR",Atlantic Canada,SaltWireNetwork,0,0,2021-06-18 01:14:20
16,"Late to post this, but it was a strong day of action on June 10th across Nova Scotia in support of 10 #PaidSickDays for all! via @fightfor15hfx #nspoli https://t.co/aNW2gajJjF",Unama’ki,Monika_Dutt,1,3,2021-06-18 01:03:01
17,Prosecutors outline case against Cape Breton family charged with multimillion-dollar tax fraud | Saltwire https://t.co/lw2st8k4Dn,"Halifax, Nova Scotia, Canada",chronicleherald,0,0,2021-06-18 00:48:16
18,"Nova Scotia needs to answer questions right up to the Parliament and Health Minister. Hearing some stories on their doctor shortage.

Halifax family questions delay in treatment after son, 19, dies of meningitis - CBC News  https://t.co/fKBB70qGyd",,Conspiracysk,0,0,2021-06-18 00:39:46
19,"Halifax family questions delay in treatment after son, 19, dies of meningitis | CBC News.  So terribly sorry for the people who loved this beautiful young man https://t.co/ykgB87oM3p",,McdonaldMcdo54,0,0,2021-06-18 00:29:57
20,Cape Breton B&amp;B owner feels vindicated with Nova Scotia tourism funding program | Saltwire https://t.co/tAsWwd8sNR,"Halifax, Nova Scotia, Canada",chronicleherald,2,2,2021-06-18 00:14:17
21,Great Canadian Gaming Announces the Reopening of Casino Nova Scotia - Yahoo Finance https://t.co/DNFdkisZfI,,OG_Greentee,0,0,2021-06-18 00:10:32
22,Nova Scotia RCMP seize cannabis among drugs in well-armed trafficking ring https://t.co/IjMmkHQ07A,"Toronto, Ontario",TheGrowthOp,0,0,2021-06-18 00:06:54
23,Indigenous-led project purchases land to protect popular Cape Breton hiking spot | Saltwire https://t.co/bnp1lyx2tR,"Halifax, Nova Scotia, Canada",chronicleherald,6,16,2021-06-17 23:57:25
24,But does it have a spot to jump off? https://t.co/UJz1bCcFyJ,,Dartmouthian1,0,2,2021-06-17 23:41:08
25,"#FourthWaveCanada
Will the Atlantic bubble burst before it forms again?
Nova Scotia caught off guard by New Brunswick border reopening
https://t.co/JnUqXHhHlY",Canada,PlanNineNorth,0,0,2021-06-17 23:37:02
26,Mira Gut getting new bridge 4 years after deteriorating span torn down https://t.co/tNEDDVuc36 https://t.co/4xjdNZsRd1,Nova Scotia,CBCNS,2,10,2021-06-17 23:32:03
27,insane that they're still polygraph testing potential employees https://t.co/tlmgwZLKCC,the oubliette ,ChalicothereX,0,10,2021-06-17 23:03:40
28,"4 weeks later when NB is in crisis mode, Nova Scotia and PEI will look smart and safe https://t.co/LQHodOQ7Wa","Charlottetown, Prince Edward Island",sdpate,0,0,2021-06-17 23:01:41
29,Cigarette sales in Nova Scotia increasing: after vape flavour ban. https://t.co/gwSiRqfIS4 via @HalifaxToday Help stop NB go the same way: https://t.co/ymA8zxXnzR,"Toronto, Ontario, Canada",tobacco21ca,0,0,2021-06-17 22:56:22
30,"Nova Scotia Starting Second Phase of Reopening, Opening Border to Atlantic Canada

https://t.co/WZ3S9V9Vgt",Dubai,heba_hashem,0,0,2021-06-17 22:52:17
31,"aka the Chester-St. Margaret’s riding play by ⁦@LiberalPartyNS⁩ government. 

N.S. highway twinning projects on time, mostly on budget 

#chsm #nspoli #AsphaltPolitics  https://t.co/nJutzo9ObV","Head of St. Marg's Bay, NS",BigJMcC,0,0,2021-06-17 22:38:23
32,"@Rogers This is positive news.  Something to remember, however, is not all rural Nova Scotia has cell phone coverage yet…it’s been a definite problem during online teaching.",,RubyAnnCameron2,0,1,2021-06-17 22:35:17
33,"N.S. highway twinning projects on time, mostly on budget https://t.co/rtTAvgulaK https://t.co/UtT1x4HOYL",Nova Scotia,CBCNS,10,24,2021-06-17 22:32:31
34,Dads organize bike event for Autism Pictou County | Saltwire https://t.co/Q2Bdi6iklZ,"New Glasgow, Nova Scotia",ngnews,1,1,2021-06-17 22:23:47
35,Nova Scotia surprised by New Brunswick's 'risk tolerance' in opening to Canada https://t.co/0BQrAnAUqO https://t.co/3QzYwDc1qi,"Halifax, Nova Scotia",HalifaxToday,1,2,2021-06-17 22:23:37
36,UPDATED: Potential COVID-19 exposure notices issued for 6 central zone locations https://t.co/VmUh2lcz06 https://t.co/NKmZSTTc5K,Nova Scotia,CBCNS,4,6,2021-06-17 22:16:55
37,Nova Scotia caught off guard by New Brunswick border reopening: https://t.co/rdbiTrjo0u https://t.co/sNDNRjkB0N,Fredericton,CBCNB,4,8,2021-06-17 22:08:08
38,"In 2019, Halifax had the highest rate of police-reported human trafficking in the country. At more than 10 incidents per 100,000 people, it's 7.5 times higher than the national average rate.  https://t.co/rSBNpZTXs6","Nova Scotia, Canada",NSRadFems,0,0,2021-06-17 22:03:37
39,"Halifax family questions delay in treatment after son, 19, dies of meningitis https://t.co/Afoj0qrB9F",Canada,CanNews24,0,0,2021-06-17 21:56:11
40,"What irony if Canada, former peacekeepers extraordinaire, got UN peacekeepers called on them. It's a bit of farce when peacekeepers will only come at the behest government, when government itself may be the source of or choosing not to stop the oppression
https://t.co/DBtYCwTBBo",,undrstndncanada,0,0,2021-06-17 21:50:52
41,Nova Scotia privacy commissioner calls for strong vaccine passport privacy protections https://t.co/jtv0Lx0Ebp,The cloud ☁,Sociability,0,0,2021-06-17 21:44:32
42,Mulgrave going to the polls over urban chickens | Saltwire https://t.co/EUf6REecSl,"Halifax, Nova Scotia, Canada",chronicleherald,0,0,2021-06-17 21:40:56
43,Nova Scotia caught off guard by New Brunswick border reopening https://t.co/LNMKosbGKJ https://t.co/n02kyTpUTD,Nova Scotia,CBCNS,7,41,2021-06-17 21:32:39
44,"Halifax family questions delay in treatment after son, 19, dies of meningitis

Remember back in the day when the world believed we had one of the best medical stytem?
#Canada
#Covid_19

https://t.co/tmatyOjaT5",,9Krystalcat,0,0,2021-06-17 21:26:46
45,Rankin not ready to commit $25M for affordable housing as recommended by commission | CBC News https://t.co/wQdnwMkxHE,Halifax,betsyeldon,0,1,2021-06-17 21:12:37
46,Cape Breton B&amp;B owner feels vindicated with Nova Scotia tourism funding program | Saltwire https://t.co/ZoXXvOyqYx https://t.co/5JuE66GfB4,"ÜT: 46.16069,-60.195819",capebretonpost,0,0,2021-06-17 21:00:43
47,"$BNS  6-K  Bank Of Nova Scotia   (17 Jun, 4:51pm)

📰 Scotiabank Announces Redemption of Non-Cumulative Preferred Share Series 36

https://t.co/H8I9QT6gz4

#BNS #6K #BankOfNovaScotia #News","Toronto, Canada",investor_feed,0,0,2021-06-17 20:52:50
48,"Keep a 2nd eye on your friends, family and youth in your community, folks. 

https://t.co/w7olkrgIIR",Atlantic Canada,JoeyTheLeaf,1,7,2021-06-17 20:49:29
49,"N.S. sees highest rate of human trafficking in Canada, incidents tripled in 2019 | CBC News https://t.co/1RSmDAgznr",Mi'kma'ki,DartmouthDerek,2,3,2021-06-17 20:46:55
50,"@shawncleary ""Maybe the polygraph tests aren't working the way they intended, given the fact that we've had many police officers charged with theft, stealing from the evidence locker, assault.” 

#HRP #Halifax https://t.co/aymJ5mqkFL","Head of St. Marg's Bay, NS",BigJMcC,0,2,2021-06-17 20:43:43
51,"Nova Scotians should be starting to wonder if their shiny, new premier amounts to anything more than his #FloweryWords. 

He sure does talk a mean game! 

#affordablehousing #nspoli #IainRankin  https://t.co/XkbZQo40yE","Head of St. Marg's Bay, NS",BigJMcC,5,9,2021-06-17 20:40:18
52,Reviews underway following death of 19-year-old man in hospital #NSpoli via @larochecbc  https://t.co/jsTsXjSRHc,Nova Scotia,MichaelTGorman,3,2,2021-06-17 20:37:43
53,Reviews underway following death of 19-year-old man in hospital https://t.co/qbwoxURUYl https://t.co/OMhuKLjRdu,Nova Scotia,CBCNS,11,41,2021-06-17 20:32:32
54,Rankin not ready to commit $25M for affordable housing as recommended by commission https://t.co/AEYmWgoDP6 https://t.co/V4Zf70Jc3J,Nova Scotia,CBCNS,9,24,2021-06-17 20:32:30
55,"Jun17, 1970 • Mike's News Agency

Photo taken OTD of Mike's News Stand building at 10062-Jasper Ave. The building on the right was the Bank of Nova Scotia. This site is now occupied by Scotia Place, a twin-tower office complex (1980~83).

📌 #EdmontonWhenAndWhere
📷 HeRMIS https://t.co/oDLVdpJwca","Edmonton, Alberta",LouisPereira_,2,20,2021-06-17 20:31:46
56,Via @MichaelTGorman  Rankin not ready to commit $25M for affordable housing as recommended by commission | CBC News https://t.co/84NQWN7nT6,"Halifax, Nova Scotia",larochecbc,6,1,2021-06-17 20:18:40
57,"“I think everybody knows someone who has driven themselves to the hospital when they should’ve called 9-1-1,” said Burrill. ""The province should do away with ambulance fees altogether.""

https://t.co/oDMZk8GUI6 #nspoli #nsndp","Nova Scotia, Canada",NSNDP,7,16,2021-06-17 20:14:33
58,"Dr. Chris Milburn was sacked as the department head of emergency medicine for Nova Scotia’s eastern zone after giving a critical interview where he challenged school closures and the “de-facto rule” of public health decision-makers. #cdnpoli  

https://t.co/b5OPc8eZRE","Toronto, Ontario",TrueNorthCentre,35,48,2021-06-17 20:12:08
59,Rankin not ready to commit $25M for affordable housing as recommended by commission #austerity https://t.co/JfKY5iPLRk,"Upper Sackville, Nova Scotia",DevetRobert,3,4,2021-06-17 20:09:49
60,Rankin not ready to commit $25M for affordable housing as recommended by commission #NSpoli https://t.co/vYnzpZZYmM,Nova Scotia,MichaelTGorman,5,5,2021-06-17 20:06:44
61,Nova Scotia illustrator wins prestigious children's book award | CBC News https://t.co/9cXSzNNQz2,Ohio,StorytellingWan,0,0,2021-06-17 20:01:27
62,"Happier, healthier animals important factor in Kleiner Farms' focus in Yarmouth County | Saltwire https://t.co/DSIeWiTWKX","Yarmouth, Digby & Shelburne NS",TVanguardnews,0,0,2021-06-17 19:33:11
63,".
""Rock the Boat Music Festival -- headliners from across the country -- the Nova Scotia rock band The Trews, Ontario duo The Reklaws, country artist Jess Moskaluke, The East Pointers from PEI.

➡️Green Park in Tyne Valley from July 30 to Aug. 1.
 https://t.co/DNOLvGp0DG",,sharonhonisch,0,0,2021-06-17 19:31:20
64,"Police investigating multiple thefts from vehicles in the HRM
https://t.co/tW87g2bDWl","Truro, Nova Scotia Canada",PureCountry995,0,0,2021-06-17 19:31:17
65,Good News from #SydneyCanada about a new #regionalairline for #YQY in #NovaScotia https://t.co/Mg1NXDMMkE https://t.co/hCAsenhXm1,,786Socialite,0,0,2021-06-17 19:30:56
66,"Shelburne County man charged with child pornography offences
https://t.co/tuVIoj4x1s","Truro, Nova Scotia Canada",PureCountry995,0,0,2021-06-17 19:30:54
67,"Police investigating multiple thefts from vehicles in the HRM
https://t.co/ewL7lQ63W6","Fredericton, New Brunswick",BounceRadio1053,0,0,2021-06-17 19:30:11
68,"Shelburne County man charged with child pornography offences
https://t.co/6XlG1VP4l3","Fredericton, New Brunswick",BounceRadio1053,0,0,2021-06-17 19:29:52
69,"Canso spaceport secures $10.5M, aims for first launch next year https://t.co/uFrQpnZkRm","Nova Scotia, Canada",lildutchgirl1,0,0,2021-06-17 19:20:53
70,Federal government backs rental housing project in Halifax | CBC News https://t.co/fJvyzhhva4,,prospercan,0,0,2021-06-17 18:44:07
71,Nova Scotia privacy commissioner calls for strong vaccine passport privacy protections https://t.co/LuFVXy94Da -via @PrivacyPros,"Washington, DC",thedpsadvisors,0,0,2021-06-17 18:35:03
72,"[Content warning] Nova Scotia sees highest rate of human trafficking in Canada, incidents tripled in 2019 https://t.co/svPfATKUhK via @CBCNews","Ontario, Canada",Ont_Ombudsman,1,1,2021-06-17 18:30:27
73,"Sad. 19-year-old dies because of #NSpoli mandated #covid19 #lockdowns mandates. Why lockdowns when #NS has a 99.97% survival rate? @JCCFCanada 
https://t.co/2BrpQQ5z6z",Canada,NewsbreakCanada,0,0,2021-06-17 18:23:44
74,"Halifax illustrator @Sydneydraws has won the CILIP Kate Greenaway Medal for his book, Small in the City. https://t.co/wBUunnYxFc",Canada,cbcbooks,2,20,2021-06-17 18:00:01
75,"Nova Scotia town to change street name, citing slaughter of Indigenous people https://t.co/el2I5PbQEI https://t.co/eJ9OTujnrT",Watch online,GlobalNational,1,5,2021-06-17 17:59:03
76,"WATCH LIVE: Nova Scotia provides a COVID-19 update after reporting 14 new cases. 

 https://t.co/lFL3yI622d",Atlantic Canada,globalhalifax,1,2,2021-06-17 17:58:04
77,Great Canadian Reopens Nova Scotia Casinos After COVID Shutdown https://t.co/SDJFDVGeny,"Panama City Beach, FL ",RounderLife,0,0,2021-06-17 17:58:01
78,"Nova Scotia town to change street name, citing slaughter of Indigenous people https://t.co/YFHJKLSdWR",Canada,CanNews24,0,0,2021-06-17 17:57:13
79,"N.S. reports 14 new COVID-19 cases; Rankin, Strang to provide update Thursday at 3 p.m. | CBC News https://t.co/ghQ6U17Pd7","Halifax, NS",Elisabeast,0,0,2021-06-17 17:56:41
80,Bedford ferry eh? What do you think of the idea? https://t.co/0kbq9W0XOa,"Halifax, Nova Scotia",infomorning,3,37,2021-06-17 17:53:54
81,"Premier Iain Rankin and Dr. Robert Strang, Nova Scotia's chief medical officer of health, are holding a COVID-19 briefing at 3 p.m. today. Watch it live. https://t.co/WHBu1eUXAe https://t.co/xCK8J5eeMv","ÜT: 46.16069,-60.195819",capebretonpost,0,0,2021-06-17 17:52:44
82,"Premier Iain Rankin and Dr. Robert Strang, Nova Scotia's chief medical officer of health, are holding a COVID-19 briefing at 3 p.m. today. Watch it live. https://t.co/ZXceGoeFEC https://t.co/G2yVwOi3Fb",Atlantic Canada,SaltWireNetwork,0,0,2021-06-17 17:52:44
83,"Premier Iain Rankin and Dr. Robert Strang, Nova Scotia's chief medical officer of health, are holding a COVID-19 briefing at 3 p.m. today. Watch it live. https://t.co/RAx7Kj7Ppv https://t.co/0R9XzFVAmo","Halifax, Nova Scotia, Canada",chronicleherald,0,0,2021-06-17 17:52:43
84,"Fourteen new COVID-19 cases reported in Nova Scotia Thursday
https://t.co/71tO8GLgCS","Truro, Nova Scotia Canada",PureCountry995,0,0,2021-06-17 17:50:40
85,"Fourteen new COVID-19 cases reported in Nova Scotia Thursday
https://t.co/ggdqeRM6Jc",Truro Nova Scotia,BounceRadio1009,0,0,2021-06-17 17:49:52
86,"WATCH: Nova Scotia's COVID-19 briefing on Thursday, June 17 https://t.co/nOYmH42re4 https://t.co/rfpzo8bAzZ","Halifax, Nova Scotia",HalifaxToday,0,0,2021-06-17 17:49:11
87,New youth group in Pictou County to host fun and inclusive events this summer | Saltwire https://t.co/6oBpQauRUC,"New Glasgow, Nova Scotia",ngnews,1,2,2021-06-17 17:41:40
88,"Happier, healthier animals important factor in Kleiner Farms' focus in Yarmouth County | Saltwire https://t.co/n4TTBAVFPI","Halifax, Nova Scotia, Canada",chronicleherald,3,1,2021-06-17 17:31:44
89,Planning underway for new commuter ferry between Bedford and Halifax https://t.co/FAn2zOKD2H,"Halifax, Canada",halifaxnews,1,11,2021-06-17 17:31:03
90,"Congratulations to Marla and Tom Dorward, owners of the Halifax Folklore Centre— just down the street from Academy campus, who are celebrating their 50th anniversary as a music hub!

Read more about them at https://t.co/L4dZHNkEc0.","Halifax, Nova Scotia, Canada",NSCADUniversity,0,1,2021-06-17 17:24:43
91,"The second of four true life ""Corner Store Stories"" illustrated by Jon Claytor and posted by the Canadian Broadcasting Company. This one's about Point Pleasant Grocery. https://t.co/tU65FjBrOJ @jonclaytor @CBC","Salinas, CA",sscsinc,0,1,2021-06-17 17:12:18
92,Halifax couple behind tutoring company plead guilty to fraud charges | Saltwire https://t.co/a929ZWy1cK,"Halifax, Nova Scotia, Canada",chronicleherald,0,0,2021-06-17 17:08:58
93,"Subsidizing for-profit developers to build units that will not meet the needs of community/will not remain permanently affordable will build a future that excludes families and children living in poverty. #NSpoli #HousingforAll #EndPoverty

https://t.co/n7FzaRxe8M",www.behindthenumbers.ca,CCPANS,7,14,2021-06-17 17:00:02
94,"Jordan Falls man charged after threatening people with a chainsaw in Shelburne
https://t.co/yLbayaep18","Truro, Nova Scotia Canada",PureCountry995,0,0,2021-06-17 16:55:06
95,"Jordan Falls man charged after threatening people with a chainsaw in Shelburne
https://t.co/ejPggmIqNT",Truro Nova Scotia,BounceRadio1009,0,0,2021-06-17 16:54:23
96,"What an awful story - this province needs to move on from its Covid obsession. #nspoli 

https://t.co/L1rNTedNuq",Halifax,TristanCPDT,0,3,2021-06-17 16:51:42
97,This is heartbreaking. May Kai rest in peace. I wish his family the comfort they desperately need. https://t.co/pPdUuMX6kK,Canada,JkhouryNS,0,0,2021-06-17 16:51:38
98,JUNE 17: 14 new COVID-19 cases announced in Nova Scotia | Saltwire https://t.co/TpmQTayA9x https://t.co/9Pd1J26nwn,Atlantic Canada,SaltWireNetwork,0,0,2021-06-17 16:47:28
99,JUNE 17: 14 new COVID-19 cases announced in Nova Scotia | Saltwire https://t.co/jFUrhMfbMa https://t.co/MMLaekXNTB,"New Glasgow, Nova Scotia",ngnews,0,0,2021-06-17 16:47:28
